{
  "title": "Tummy Tonic: Leek & Celery Edition",
  "slug": "tummy-tonic-leek-and-celery-edition",
  "emoji": "ðŸ¥£ðŸ’š",
  "metadata": {
    "cuisine": "European-inspired",
    "type": "Soup",
    "gluten_free": true,
    "difficulty": "Easy",
    "spicy": "None",
    "serves": "3â€“4 Kumplis",
    "good_for": [
      "Gentle healing",
      "Cozy evenings",
      "Soul-warming",
      "Batch cooking"
    ],
    "seasonality": "Year-round",
    "ingredient_access": "standard-eu",
    "ingredient_count": 15,
    "storage": "Fridge 3â€“4 days",
    "reheating": "Stovetop (gentle simmer) or microwave",
    "pairing": "Crusty bread, fresh parsley garnish",
    "tags": [
      "vegetarian",
      "one-pot",
      "cozy",
      "soul-warming",
      "comfort-food",
      "healing",
      "creamy",
      "no-fuss"
    ]
  },
  "timing": {
    "prep_minutes": 15,
    "total_minutes": 50
  },
  "ingredients": [
    {
      "group": "ðŸ§… Aromatics Base",
      "items": [
        { "amount": "1 tbsp", "item": "olive oil", "notes": "or Â½ tbsp olive oil + Â½ tbsp butter" },
        { "amount": "2 medium", "item": "leeks", "notes": "white and light green parts only, thinly sliced" },
        { "amount": "1 medium", "item": "onion or shallot", "notes": "finely chopped" },
        { "amount": "1 stalk", "item": "celery", "notes": "diced" },
        { "amount": "2 cloves", "item": "garlic", "notes": "minced" }
      ]
    },
    {
      "group": "ðŸ¥¬ Optional Vegetables",
      "items": [
        { "amount": "1 medium", "item": "zucchini", "notes": "chopped (optional)" },
        { "amount": "1â€“2 medium", "item": "potatoes", "notes": "about 200â€“250g, peeled and cubed (optional)" },
        { "amount": "1Â½ cups", "item": "Chinese cabbage (Napa cabbage)", "notes": "sliced (optional)" }
      ]
    },
    {
      "group": "ðŸŒ± Protein & Seasonings",
      "items": [
        { "amount": "Â½ cup", "item": "cooked lentils", "notes": "or Â¼ cup dried lentils, cooked separately" },
        { "amount": "1 tsp", "item": "dried thyme" },
        { "amount": "Â½ tsp", "item": "ground cumin" },
        { "amount": "", "item": "salt and freshly ground black pepper", "notes": "to taste" }
      ]
    },
    {
      "group": "ðŸ¥› Broth & Finishing",
      "items": [
        { "amount": "4 cups", "item": "vegetable broth" },
        { "amount": "â…“ cup", "item": "oat milk or cream" },
        { "amount": "Â½", "item": "lemon", "notes": "juice only" }
      ]
    },
    {
      "group": "ðŸŒ¿ Optional Garnishes",
      "items": [
        { "amount": "", "item": "chopped parsley or chives" },
        { "amount": "", "item": "swirl of cream or drizzle of olive oil" },
        { "amount": "", "item": "crusty bread on the side" }
      ]
    }
  ],
  "instructions": [
    {
      "group": "Prep & Base",
      "steps": [
        {
          "title": "SautÃ© the aromatics",
          "step": "In a medium pot, heat the olive oil (and butter, if using) over medium heat. Add the leeks, onion, celery, and garlic. Cook for 8â€“10 minutes, stirring occasionally, until the vegetables are soft and fragrant."
        }
      ]
    },
    {
      "group": "Building the Soup",
      "steps": [
        {
          "title": "Prepare optional vegetables",
          "step": "If using zucchini, potatoes, and/or Chinese cabbage: place them in a **heat-safe mesh insert, steaming basket, or steel soup filter** directly in the pot. This allows them to cook in the broth without being blended later.",
          "substeps": [
            { "step": "Add the optional vegetables to the pot and cook for 2â€“3 minutes, stirring gently" }
          ]
        },
        {
          "title": "Add seasonings and lentils",
          "step": "Add the dried thyme, cumin, a pinch of salt, freshly ground black pepper, and the cooked lentils. Stir to combine."
        },
        {
          "title": "Simmer in broth",
          "step": "Pour in the vegetable broth. Bring to a simmer and cook for 20â€“30 minutes, or until the potatoes (if using) are tender."
        }
      ]
    },
    {
      "group": "Blending & Finishing",
      "steps": [
        {
          "title": "Blend the base",
          "step": "Carefully remove the mesh insert containing the optional vegetables and set aside. Using an immersion blender, blend the soup base until smooth. You may blend partially for a textured finish or fully for a silky result. Return the cooked vegetables to the pot."
        },
        {
          "title": "Add cream and lemon",
          "step": "Stir in the oat milk (or cream) and lemon juice. Taste and adjust seasoning as needed."
        },
        {
          "title": "Serve",
          "step": "Ladle into bowls and garnish with parsley, chives, a swirl of cream or drizzle of olive oil. Serve hot with crusty bread."
        },
        {
          "title": "Maaâ€™s wisdom",
          "step": "For best healing, hydrate kindly: sip a glass of water or warm herbal tea alongside your bowl, and keep hydrating through the evening."
        }
      ]
    }
  ]
}
